date,url,title,pub,pub_short
12/8/2023,https://www.nzz.ch/english/people-in-war-torn-gaza-have-less-living-space-than-ever-ld.1769304,People in war torn Gaza have less living space than ever,NZZ,nzz
12/9/2023,https://www.lapresse.ca/international/moyen-orient/2023-12-09/israel-et-le-hamas-en-guerre/la-destruction-de-batiments-civils-un-crime-de-guerre.php,"Israël et le Hamas en guerre | La destruction de bâtiments civils, un « crime de guerre » | La Presse",Le Presse,presse
12/9/2023,https://www.elperiodico.com/es/internacional/resumen-guerra-israel-gaza-hamas-sh/index.html,Guerra en Israel y Gaza: resumen del conflicto en Oriente PrÃ³ximo,El Periodico de Espana,epde
12/6/2023,https://www.eldiario.es/internacional/bomba-israeli-220-habitantes-mapas-meses-masacre-gaza_1_10746823.html,Un ataque israelí por cada 220 habitantes: los mapas de dos meses de masacre en Gaza,El Diario,diario
12/6/2023,https://www.irishtimes.com/world/middle-east/2023/12/06/israels-gaza-attack-one-of-historys-heaviest-conventional-bombing-campaigns/,Israel’s Gaza attack ‘one of history’s heaviest conventional bombing campaigns’ – The Irish Times,Irish Times,it
12/13/2023,https://on.ft.com/3uOk4gP,How the loss of entire families is ravaging the social fabric of Gaza,Financial Times,ft
12/13/2023,https://abcnews.go.com/International/damage-epicenter-shifts-khan-yunis-israel-hamas-fighting/story?id=105629137,"Damage epicenter shifts to Khan Younis as Israel-Hamas fighting moves south, data shows",ABC News,abc
12/14/2023,https://www.npr.org/2023/12/14/1218643254/israel-is-using-an-ai-system-to-find-targets-in-gaza-experts-say-its-just-the-st,Here's how Israel is using artificial intelligence to find targets in Gaza.  : NPR,National Public Radio,npr
12/14/2023,https://www.thetimes.co.uk/article/almost-half-of-israels-gaza-strikes-use-unguided-missiles-9tw0gm3gq,Almost half of Israel’s Gaza strikes ‘use unguided missiles’,The Times,times
12/14/2023,https://elpais.com/internacional/2023-12-14/mapas-y-graficos-de-la-guerra-entre-israel-y-gaza-que-explican-como-evoluciona-el-conflicto.html?outputType=amp,Mapas y gráficos de la guerra entre Israel y Gaza que explican cómo evoluciona el conflicto | Internacional | EL PAÍS,El Pais,ep
12/14/2023,https://www.derstandard.at/story/3000000198583/dutzende-verwandte-im-krieg-verloren-die-menschen-in-gaza-verdienen-auch-zu-leben?ref=rss,Dutzende Verwandte im Krieg verloren: 'Die Menschen in Gaza verdienen auch zu leben',Der Standard,ds
12/1/2023,https://www.scientificamerican.com/article/inside-the-satellite-tech-revealing-gazas-destruction/,Inside the Satellite Tech Revealing Gaza’s Destruction,Scientific American,sciam
12/20/2023,https://www.businessinsider.com/researchers-mapped-gaza-damage-buildings-destroyed-israel-hamas-2023-12,"Researchers Mapped Gaza Damage, Over a Third of Buildings Destroyed",Business Insider,bi
12/21/2023,https://www.rtlnieuws.nl/nieuws/buitenland/artikel/5425491/verwoesting-gaza-na-10-weken-oorlog,Zo groot is de verwoesting in Gaza na 10 weken oorlog | RTL Nieuws,RTL News,rtl
12/21/2023,https://on.ft.com/48jgVo0,Visual analysis: the wastelands in Gaza’s two biggest cities,Financial Times,ft
12/20/2023,https://stories.lavanguardia.com/internacional/20231220/74301/hospital-asediado-en-gaza,Asedio al último hospital operativo en el norte de Gaza,La Vanguardia,lv
12/22/2023,https://apnews.com/article/israel-gaza-bombs-destruction-death-toll-scope-419488c511f83c85baea22458472a796,"Israeli military campaign in Gaza among deadliest in history, experts say | AP News",AP News,ap
12/22/2023,https://wapo.st/4794UjR,"Photos, videos and maps show Palestinians have no safe place to go in Gaza ",The Washington Post,wapo
12/23/2023,https://amp.theguardian.com/world/2023/dec/22/israel-widens-ground-offensive-gaza-un-aid-resolution-talks-continue,Israel widens ground offensive in Gaza as UN aid resolution talks continue | Israel-Gaza war | The Guardian,The Guardian,guardian
12/21/2023,https://bnnbreaking.com/watch-now/satellite-imagery-unveils-the-extent-of-gazas-destruction/,Gaza's Devastation Uncovered Through Satellite Imagery,BNN Bloomberg,bloomberg
12/22/2023,https://www.reuters.com/graphics/ISRAEL-PALESTINIANS/MAPS/movajdladpa/#bombardment-in-gaza-intensifies,Mapping the conflict in Israel and Gaza,Reuters,reuters
12/26/2023,https://www.nytimes.com/interactive/2023/12/26/world/middleeast/gaza-south-displaced-damage.html,Nearly Two Million Crowd Into Gaza’s South as Fighting Intensifies,The New York Times,nyt
12/27/2023,https://on.ft.com/4ayWO72,Israel-UN relations plunge to new low as Gaza war rages,Financial Times,ft
12/30/2023,https://www.cbc.ca/news/politics/israel-gaza-bombing-hamas-civilian-casualties-1.7068647,"Israel's Gaza bombing campaign is the most destructive of this century, analysts say | CBC News",CBC News,cbc
12/30/2023,https://www.wsj.com/world/middle-east/gaza-destruction-bombing-israel-aa528542?mod=hp_lead_pos7,The Ruined Landscape of Gaza After Nearly Three Months of Bombing,Wall Street Journal,wsj